{"dependencies":[],"modules":[{"module":"pr_trust_policy","path":"src/pr_trust_policy.joan","source_digest":{"algorithm":"sha256","domain":"joan.source.v1","profile":"joan-hash-v1","value":"4a0a2fd6c1faa57fd5d36bb0cb9208314bfe5c88e64d63c8bd9114e45de1b5a8"}}],"package":{"edition":"alpha-1","name":"pr-trust-policy","namespace":"org.ledaction.joan"},"root_module":"pr_trust_policy","schema":"joan.package-manifest.v0"}
