{"dependencies":[],"modules":[{"module":"package_demo","path":"src/package_demo.joan","source_digest":{"algorithm":"sha256","domain":"joan.source.v1","profile":"joan-hash-v1","value":"f7c464b8943c89657d953818e8fb325ab55ddb5e5cde892c17a7f877d0ebe921"}}],"package":{"edition":"alpha-1","name":"package-demo","namespace":"org.ledaction.joan"},"root_module":"package_demo","schema":"joan.package-manifest.v0"}
